<?xml version="1.0" encoding="iso-8859-1" standalone="no"?>
<jeu xmlns="http://game.org"
xmlns:xsi="http://www.w3.org/2001/XMLSchema-instance"
xsi:schemaLocation="http://game.org /Content/xsd/game.xsd">
  <id>52ea95808de0c</id>
  <datecreation>30012014</datecreation>
  <nbsituation>2</nbsituation>
  <titre>Monjeu</titre>
  <createur>christophe.barreto</createur>
  <description>Jeu de guerre</description>
  <difficulte>2</difficulte>
  <situation type="Narration">
    <situationCode>52ea95808e475</situationCode>
    <situationTitle>Introduction</situationTitle>
    <situationExposition>Vous etes dans une auberge.</situationExposition>
    <question>
      <label>Ou allez vous ?</label>
      <choix>
        <rep val="0">Je veux sortir d'ici et me rendre au bar</rep>
        <rep val="1">Je veux sortir d'ici et me rendre à l'armurerie</rep>
      </choix>
      <suivant>
        <si>
          <test val="0">
            <points>10</points>
            <code>1</code>
          </test>
          <test>
            <points>10</points>
            <code>52ea9a293610b</code>
          </test>
        </si>
      </suivant>
    </question>
  </situation>
  <situation type="Combat">
    <situationCode>52ea9a293610b</situationCode>
    <situationTitle>Rencontre avec Zeus</situationTitle>
    <situationExposition>Il vous defie pour tester votre valeur au combat.</situationExposition>
    <ennemi>Zeus</ennemi>
    <question>
      <label>Qu'allez vous faire ?</label>
      <choix>
        <rep val="0">Attaquer</rep>
        <rep val="1">Prendre la fuite</rep>
      </choix>
      <suivant>
        <si>
          <test val="0">
            <si>
              <test vieEnnemi="0">
                <code>0</code>
                <pointsVictoire>200</pointsVictoire>
              </test>
              <test vieHeros="0">
                <code>0</code>
                <pointsDefaite>10</pointsDefaite>
              </test>
            </si>
          </test>
          <test val="1">
            <code>0</code>
            <points>30</points>
          </test>
        </si>
      </suivant>
    </question>
  </situation>
</jeu>
